{
  "$schema": "https://json-schema.org/draft/2020-12/schema",
  "$id": "https://secb.local/contracts/handoff-envelope.schema.json",
  "title": "SecB Handoff Envelope",
  "type": "object",
  "additionalProperties": false,
  "required": ["handoff_id", "version", "project_id", "work_package_id", "source_session_id", "destination_role", "objective", "authorized_scope", "work_completed", "artifacts", "assumptions", "evidence_refs", "checks", "limitations", "unresolved_findings", "risks", "recommended_next_action", "context_delta", "content_hash"],
  "properties": {
    "handoff_id": {"type": "string", "minLength": 1},
    "version": {"type": "integer", "minimum": 1},
    "project_id": {"type": "string", "minLength": 1},
    "work_package_id": {"type": "string", "minLength": 1},
    "source_session_id": {"type": "string", "minLength": 1},
    "destination_role": {"type": "string", "minLength": 1},
    "objective": {"type": "string", "minLength": 1},
    "authorized_scope": {"type": "array", "minItems": 1, "items": {"type": "string"}},
    "work_completed": {"type": "array", "items": {"type": "string"}},
    "artifacts": {"type": "array", "items": {"type": "string"}},
    "assumptions": {"type": "array", "items": {"type": "string"}},
    "evidence_refs": {"type": "array", "items": {"type": "string"}},
    "checks": {"type": "array", "items": {"type": "string"}},
    "limitations": {"type": "array", "items": {"type": "string"}},
    "unresolved_findings": {"type": "array", "items": {"type": "string"}},
    "risks": {"type": "array", "items": {"type": "string"}},
    "recommended_next_action": {"type": "string", "minLength": 1},
    "context_delta": {"type": "array", "items": {"type": "string"}},
    "content_hash": {"type": "string", "pattern": "^[a-f0-9]{64}$"}
  }
}
